{
  "candidate_id": "CAN-FCFD93A87E78",
  "canonical_title": "QCD critical point",
  "canonical_statement": "Does a QCD critical point exist in the temperature–baryon-chemical-potential phase diagram, and if it does exist, what are its critical temperature and density, as established by a first-principles study based on QCD?",
  "definitions": [
    "Quantum chromodynamics (QCD), the fundamental theory of the strong interaction, is expected to exhibit a rich phase structure as temperature $T$ and baryon chemical potential $\\mu_B$ (which controls net baryon density) are varied. At $\\mu_B = 0$, first-principles lattice QCD simulations have established that the transition from hadronic matter to the quark-gluon plasma is a smooth analytic crossover at a pseudocritical temperature $T_c \\approx 155\\text{--}158$ MeV, not a true phase transition. Many phenomenological models and several QCD-based functional studies predict that at sufficiently large $\\mu_B$ this crossover strengthens into a line of first-order phase transitions, which must then terminate at a critical endpoint — the QCD critical point — generically expected to lie in the three-dimensional Ising ($Z_2$) universality class, like the endpoint of the liquid-gas coexistence line of water.",
    "The obstacle to a first-principles settlement is the fermion sign problem. In lattice QCD the partition function is evaluated by Monte Carlo importance sampling over gauge configurations, weighted by the fermion determinant. At nonzero real quark chemical potential the Euclidean action becomes complex, the determinant loses positivity, and importance sampling is no longer applicable. All existing workarounds — reweighting, Taylor expansion in $\\mu_B/T$, analytic continuation from imaginary chemical potential, canonical (fixed-baryon-number) formulations, complex Langevin evolution, and Lefschetz thimble methods — either are limited to small $\\mu_B/T$ or lose reliability precisely in the low-temperature, high-density region where a critical point would reside. Nagata's 2022 review (Prog. Part. Nucl. Phys. 127, 103991) documents this situation and states that even the existence of the critical point is not established.",
    "The unresolved target is the conditional two-part question posed by the source review: establish from first principles whether a QCD critical point exists in the $T$–$\\mu_B$ phase diagram, and, if it does, determine its critical temperature and density. 'First-principles' means a controlled calculation based on QCD itself — for example a lattice or functional-QCD computation with quantified systematic and statistical uncertainties — as opposed to phenomenological model estimates, which the source explicitly says cannot settle the question. Post-2022 literature has sharpened constraints (a continuum-extrapolated lattice equation-of-state analysis excludes a critical point at $\\mu_B < 450$ MeV at the $2\\sigma$ level under its continuation ansatz, and RHIC BES-II measurements narrow the experimentally viable region) without resolving the question."
  ],
  "scope": "The existence or non-existence of the QCD critical point and, if it exists, the first-principles determination of its critical temperature and density on the QCD phase diagram; the source review documents that this remains open because the sign problem at nonzero quark chemical potential defeats importance sampling and undermines current methods precisely in the relevant low-temperature, high-density region.",
  "aliases": [
    "QCD critical endpoint",
    "Critical point of the QCD phase diagram",
    "QCD critical point search"
  ],
  "named_problem": true,
  "authoritative_formulation": {
    "citation": "K. Nagata, Finite-density lattice QCD and sign problem: current status and open problems, Prog. Part. Nucl. Phys. 127, 103991 (2022), arXiv:2108.12423, Sec. 1.1.1",
    "url": "https://ar5iv.labs.arxiv.org/html/2108.12423",
    "exact_excerpt": "However, the QCD critical point has not been discovered so far. Although there are many phenomenological studies regarding the QCD critical point, the location of the critical point on the phase diagram is not known. Even the very existence is not established. The first-principle study based on QCD is needed to establish the existence or non-existence of the QCD critical point, and if it does exist, to determine the critical temperature and density.",
    "evidence_identifier": "arxiv-2108.12423-fulltext"
  },
  "formulation_alignment": "exact",
  "formulation_change": {
    "changed": false,
    "change_type": "none",
    "changed_fields": [],
    "rationale": "No major later progress was found that resolves or definitively narrows the source question. Post-2022 results constrain the critical-point region — the Borsanyi et al. 2025 continuum-extrapolated lattice equation-of-state analysis excludes a critical point at $\\mu_B < 450$ MeV only at the $2\\sigma$ level under a specific constant-entropy-density continuation ansatz, and STAR BES-II measurements narrow the viable experimental region with baseline-model-dependent significance — but neither settles existence even within the constrained regions, other lattice analyses (multipoint Pade, Lee-Yang edge searches) report candidate signals, and the question remains open in its full source generality. Canonical title, statement, scope, and answer types are therefore frozen exactly as received from Triage.",
    "evidence_identifiers": []
  },
  "resolution_status": "still_open",
  "resolution_conclusion": "likely_open",
  "resolution_confidence": "high",
  "literature_treatment": "Post-2022 literature across all three fronts treats the same core as open. On the lattice front, the Wuppertal-Budapest collaboration's improved continuum-extrapolated equation of state (arXiv:2502.10267, 2025) searches for the onset of first-order behavior along contours of constant entropy density from imaginary to real chemical potential and excludes a critical point at $\\mu_B < 450$ MeV only at the $2\\sigma$ level, explicitly leaving the higher-density region undecided; companion efforts (multipoint Pade approximants by Clarke et al., PRD 112, L091504 (2025); Lee-Yang edge singularity searches in high-statistics data, arXiv:2502.03211) continue to hunt for a signal rather than reporting closure. Functional QCD methods (fRG/DSE) continue to predict candidate critical-endpoint locations but with acknowledged truncation dependence, so they do not constitute a controlled first-principles determination. On the experimental front, STAR's precision BES-II net-proton fluctuation measurements (PRL 135, 142301 (2025), arXiv:2504.00817) find deviations from non-critical baselines at the $2\\text{--}5\\sigma$ level around $\\sqrt{s_{NN}} \\approx 19.6$ GeV and are publicly summarized as ruling out a critical point in the regions accessed at top RHIC and LHC energies while leaving lower energies open — narrowing, not closing, the search. Review-level treatments (Aarts et al., Prog. Part. Nucl. Phys. 133, 104070 (2023)) confirm that no sign-problem method yet provides the final solution. No later work claims a controlled first-principles establishment, exclusion over the full relevant region, or rigorous no-go result.",
  "status_rationale": "A systematic same-core web audit (the LKM/Gaia route was unavailable in this environment, a stated coverage limitation) was run across the canonical statement and aliases with closure-oriented queries, covering lattice QCD, functional methods, and the experimental BES-II program through August 2026. Every inspected item treats existence and location as undecided: the strongest lattice result is a $2\\sigma$, ansatz-dependent regional exclusion; the strongest experimental result is a baseline-dependent deviation, not a discovery; functional predictions are truncation-dependent; and 2023–2026 reviews and status reports continue to list the critical point as an open problem. This constitutes continuing active treatment of the identical question with no credible closure, justifying still_open with likely_open at high confidence. The residual uncertainty is not about whether closure has been claimed — it clearly has not — but only about completeness of coverage of very recent preprints, which the 2026 items inspected mitigate.",
  "checked_through": "2026-08 (lattice, functional-QCD, and experimental heavy-ion literature inspected through August 2026, including 2025–2026 BES-II publications and 2025–2026 lattice critical-endpoint searches)",
  "major_progress_found": false,
  "major_progress_effect": "none",
  "surviving_open_core": "The full source question survives: establish by a first-principles QCD study whether a critical point exists in the $T$–$\\mu_B$ phase diagram, and, if it exists, determine its critical temperature and density with controlled uncertainties. The only refinement to record is contextual, not a reformulation: the region $\\mu_B < 450$ MeV is now excluded at $2\\sigma$ by one lattice continuation ansatz and the high-energy-collision region is experimentally disfavored, so the live target concentrates at moderate-to-large $\\mu_B$ — but existence remains unestablished everywhere, and no definitive regional closure has been accepted by the community.",
  "post_progress_decision": "unassessed",
  "importance_level": "high",